{
  "config_version": 1,
  "runtime": {
    "root": ".runtime",
    "runs": ".runtime/runs",
    "recordings": ".runtime/recordings"
  },
  "openttd": {
    "executable": ".runtime/openttd/openttd.exe",
    "server_config": ".runtime/openttd/server.cfg",
    "spectator_config": ".runtime/openttd/spectator.cfg",
    "admin_port": 3977,
    "admin_credential_ref": "credman:OpenTTDModelArena/AdminPort"
  },
  "obs": {
    "host": "127.0.0.1",
    "port": 4455,
    "credential_ref": "credman:OpenTTDModelArena/OBS",
    "scene_collection": "OpenTTD Model Arena",
    "executable": "obs64"
  },
  "network": {
    "bind_address": "127.0.0.1"
  },
  "logging": {
    "level": "Information",
    "redact_secrets": true
  },
  "doctor": {
    "minimum_free_disk_gb": 20
  }
}
